{"schema_version":"1.0","job_id":"fixture-job","attempt_id":"fixture-attempt","snapshot_digest":"aaaaaaaaaaaaaaaaaaaaaaaaaaaaaaaaaaaaaaaaaaaaaaaaaaaaaaaaaaaaaaaa","revision":0,"status":"queued","created_at":"2026-10-20T12:00:00Z","updated_at":"2026-10-20T12:00:00Z","progress_percent":null,"last_heartbeat_at":null,"error":null}
